{
  "schema_version": "1.0",
  "command": "mv",
  "variant": "gnu",
  "match": {
    "probe": {
      "args": ["--version"],
      "expect": "success",
      "output_contains": "GNU coreutils"
    }
  },
  "mode": "authoritative",
  "confidence": "verified",
  "provenance": {
    "platform": "linux",
    "tool_version": "9.7",
    "package": "coreutils",
    "source": "help",
    "checked_on": "2026-07-27",
    "command": "docker run --rm debian:stable-slim mv --help",
    "environment": "debian@sha256:328d16499860ae6cb9b345e2e4cebca08c2a36e4f7278482c7bd1f39d71e5bfd",
    "notes": "Debian slim images ship no man pages, so the flag list was read from GNU --help, which is complete by GNU convention. The -f/-i/-n exclusion is stated outright in that output: 'If you specify more than one of -i, -f, -n, only the final one takes effect.' Enum values for --update and --backup come from the explanatory paragraphs in the same --help output."
  },
  "description": "Rename SOURCE to DEST, or move SOURCE(s) to DIRECTORY. Mandatory arguments to long options are mandatory for short options too.",
  "flags": [
    { "long": "--backup", "type": "enum", "value_name": "CONTROL", "enum_values": ["none", "off", "numbered", "t", "existing", "nil", "simple", "never"], "description": "Make a backup of each existing destination file. The version control method may also be selected through the VERSION_CONTROL environment variable." },
    { "short": "-b", "type": "boolean", "description": "Like --backup but does not accept an argument." },
    { "long": "--debug", "type": "boolean", "description": "Explain how a file is copied. Implies -v." },
    { "long": "--exchange", "type": "boolean", "description": "Exchange source and destination." },
    { "short": "-f", "long": "--force", "type": "boolean", "conflicts_with": ["-i", "-n"], "description": "Do not prompt before overwriting. If you specify more than one of -i, -f, -n, only the final one takes effect." },
    { "short": "-i", "long": "--interactive", "type": "boolean", "conflicts_with": ["-f", "-n"], "description": "Prompt before overwrite. If you specify more than one of -i, -f, -n, only the final one takes effect." },
    { "short": "-n", "long": "--no-clobber", "type": "boolean", "conflicts_with": ["-f", "-i"], "description": "Do not overwrite an existing file. If you specify more than one of -i, -f, -n, only the final one takes effect." },
    { "long": "--no-copy", "type": "boolean", "description": "Do not copy if renaming fails." },
    { "long": "--strip-trailing-slashes", "type": "boolean", "description": "Remove any trailing slashes from each SOURCE argument." },
    { "short": "-S", "long": "--suffix", "type": "string", "value_name": "SUFFIX", "description": "Override the usual backup suffix. The default is '~', unless set with SIMPLE_BACKUP_SUFFIX." },
    { "short": "-t", "long": "--target-directory", "type": "path", "value_name": "DIRECTORY", "conflicts_with": ["-T"], "description": "Move all SOURCE arguments into DIRECTORY." },
    { "short": "-T", "long": "--no-target-directory", "type": "boolean", "conflicts_with": ["-t"], "description": "Treat DEST as a normal file." },
    { "long": "--update", "type": "enum", "value_name": "UPDATE", "enum_values": ["all", "none", "none-fail", "older"], "description": "Control which existing files are updated. 'all' replaces every existing destination file; 'none' skips them without failing; 'none-fail' skips and diagnoses them; 'older' (the default when --update is given) replaces files older than the source." },
    { "short": "-u", "type": "boolean", "description": "Equivalent to --update=older." },
    { "short": "-v", "long": "--verbose", "type": "boolean", "description": "Explain what is being done." },
    { "short": "-Z", "long": "--context", "type": "boolean", "description": "Set SELinux security context of destination file to default type." },
    { "long": "--help", "type": "boolean", "description": "Display this help and exit." },
    { "long": "--version", "type": "boolean", "description": "Output version information and exit." }
  ],
  "positional_args": [
    { "name": "source", "type": "path", "variadic": true, "required": true, "description": "File to rename or move." },
    { "name": "dest", "type": "path", "required": true, "description": "Destination file, or the DIRECTORY multiple SOURCEs are moved into. Not given when -t is used." }
  ],
  "annotations": {
    "readonly": false,
    "destructive": true,
    "idempotent": false,
    "requires_approval": true
  }
}
